{"algorithm":"typaxis.forced-page-break-manifest/1","break_usage_sha256":"dfcaf020f4599bc01976c1a318f9dc05225135b75e098d52b5fb1b017e0e6a57","contract":"typaxis.contract/1.2","flow_registry_sha256":"3d32fdfbe55d147f613c52b266dfcad63b51d87fe46c19bb687e921145c77953","forced_page_breaks":[{"after_cursor":{"flow_id":0,"flow_local_ordinal":1},"before_cursor":{"flow_id":0,"flow_local_ordinal":0},"break_node_id":1,"document_ordinal":0,"produced_page_index":1},{"after_cursor":{"flow_id":0,"flow_local_ordinal":3},"before_cursor":{"flow_id":0,"flow_local_ordinal":2},"break_node_id":3,"document_ordinal":1,"produced_page_index":2},{"after_cursor":{"flow_id":0,"flow_local_ordinal":4},"before_cursor":{"flow_id":0,"flow_local_ordinal":3},"break_node_id":4,"document_ordinal":2,"produced_page_index":3},{"after_cursor":{"flow_id":0,"flow_local_ordinal":6},"before_cursor":{"flow_id":0,"flow_local_ordinal":5},"break_node_id":6,"document_ordinal":3,"produced_page_index":4}],"package_sha256":"844d3c3ce4450023b6cd749a6dc91a03f944ed469afff57cb1591ee6122a932e","page_count":5,"pages":[{"is_blank":true,"page_index":0,"painted_content_count":0},{"is_blank":false,"page_index":1,"painted_content_count":1},{"is_blank":true,"page_index":2,"painted_content_count":0},{"is_blank":false,"page_index":3,"painted_content_count":1},{"is_blank":true,"page_index":4,"painted_content_count":0}],"pdf_observation_sha256":"3899e0f46d8714e7f98dd17045ccccdeff276b15da3d825878228b48a3fd2751","pdf_page_tree_sha256":"8d0878ba9ae9a1a416cf503ea5d08c219116b578dc361c861eaa237b47f0e7b5","policy_version":"typaxis.basic-forced-page-break-policy/1"}
